
2-species diurnal advection-diffusion problem
  10 by 10 mesh on 4 processors
  Using ARKBBDPRE preconditioner module
    Difference-quotient half-bandwidths are mudq = 10,  mldq = 10
    Retained band block half-bandwidths are mukeep = 2,  mlkeep = 2

Preconditioner type is:  jpre = SUN_PREC_LEFT

t = 7.20e+03   no. steps = 70   stepsize = 1.17e+02
At bottom left:  c1, c2 =    1.047e+04    2.527e+11 
At top right:    c1, c2 =    1.118e+04    2.700e+11 

t = 1.44e+04   no. steps = 97   stepsize = 5.42e+02
At bottom left:  c1, c2 =    6.659e+06    2.582e+11 
At top right:    c1, c2 =    7.301e+06    2.833e+11 

t = 2.16e+04   no. steps = 115   stepsize = 6.88e+02
At bottom left:  c1, c2 =    2.665e+07    2.993e+11 
At top right:    c1, c2 =    2.931e+07    3.313e+11 

t = 2.88e+04   no. steps = 133   stepsize = 2.56e+02
At bottom left:  c1, c2 =    8.702e+06    3.380e+11 
At top right:    c1, c2 =    9.650e+06    3.751e+11 

t = 3.60e+04   no. steps = 161   stepsize = 7.54e+01
At bottom left:  c1, c2 =    1.404e+04    3.387e+11 
At top right:    c1, c2 =    1.561e+04    3.765e+11 

t = 4.32e+04   no. steps = 201   stepsize = 1.78e+03
At bottom left:  c1, c2 =   -1.743e-07    3.382e+11 
At top right:    c1, c2 =    4.516e-06    3.804e+11 

t = 5.04e+04   no. steps = 205   stepsize = 1.12e+03
At bottom left:  c1, c2 =    9.105e-07    3.358e+11 
At top right:    c1, c2 =   -7.997e-07    3.864e+11 

t = 5.76e+04   no. steps = 210   stepsize = 9.41e+02
At bottom left:  c1, c2 =   -7.072e-08    3.320e+11 
At top right:    c1, c2 =    4.778e-07    3.909e+11 

t = 6.48e+04   no. steps = 215   stepsize = 1.91e+03
At bottom left:  c1, c2 =    4.918e-08    3.313e+11 
At top right:    c1, c2 =    9.983e-07    3.963e+11 

t = 7.20e+04   no. steps = 218   stepsize = 2.22e+03
At bottom left:  c1, c2 =   -9.565e-07    3.330e+11 
At top right:    c1, c2 =   -8.353e-06    4.039e+11 

t = 7.92e+04   no. steps = 221   stepsize = 2.32e+03
At bottom left:  c1, c2 =   -7.864e-11    3.334e+11 
At top right:    c1, c2 =   -4.539e-09    4.120e+11 

t = 8.64e+04   no. steps = 224   stepsize = 2.48e+03
At bottom left:  c1, c2 =   -2.012e-08    3.352e+11 
At top right:    c1, c2 =    3.361e-07    4.163e+11 


Final Statistics: 

lenrw   =  4118     leniw   =   291
lenrwls =  2455     leniwls =   126
nst     =   224     nfe     =     0
nfe     =  3299     nfels   =  6838
nni     =  2066     nli     =  6838
nsetups =    73     netf    =    22
npe     =     4     nps     =  8822
ncfn    =     0     ncfl    =   525

In ARKBBDPRE: real/integer local work space sizes = 1300, 192
             no. flocal evals. = 88


-------------------------------------------------------------------


Preconditioner type is:  jpre = SUN_PREC_RIGHT

t = 7.20e+03   no. steps = 69   stepsize = 1.17e+02
At bottom left:  c1, c2 =    1.047e+04    2.527e+11 
At top right:    c1, c2 =    1.118e+04    2.700e+11 

t = 1.44e+04   no. steps = 96   stepsize = 5.40e+02
At bottom left:  c1, c2 =    6.659e+06    2.582e+11 
At top right:    c1, c2 =    7.301e+06    2.833e+11 

t = 2.16e+04   no. steps = 114   stepsize = 6.89e+02
At bottom left:  c1, c2 =    2.665e+07    2.993e+11 
At top right:    c1, c2 =    2.931e+07    3.313e+11 

t = 2.88e+04   no. steps = 132   stepsize = 2.33e+02
At bottom left:  c1, c2 =    8.702e+06    3.380e+11 
At top right:    c1, c2 =    9.650e+06    3.751e+11 

t = 3.60e+04   no. steps = 160   stepsize = 7.48e+01
At bottom left:  c1, c2 =    1.404e+04    3.387e+11 
At top right:    c1, c2 =    1.561e+04    3.765e+11 

t = 4.32e+04   no. steps = 200   stepsize = 1.75e+03
At bottom left:  c1, c2 =   -1.510e-07    3.382e+11 
At top right:    c1, c2 =   -1.683e-07    3.804e+11 

t = 5.04e+04   no. steps = 204   stepsize = 1.28e+03
At bottom left:  c1, c2 =    7.984e-09    3.358e+11 
At top right:    c1, c2 =   -1.330e-08    3.864e+11 

t = 5.76e+04   no. steps = 209   stepsize = 9.83e+02
At bottom left:  c1, c2 =    6.200e-08    3.320e+11 
At top right:    c1, c2 =    1.082e-08    3.909e+11 

t = 6.48e+04   no. steps = 214   stepsize = 1.89e+03
At bottom left:  c1, c2 =   -1.625e-09    3.313e+11 
At top right:    c1, c2 =    4.341e-11    3.963e+11 

t = 7.20e+04   no. steps = 217   stepsize = 2.21e+03
At bottom left:  c1, c2 =    1.383e-07    3.330e+11 
At top right:    c1, c2 =    1.180e-06    4.039e+11 

t = 7.92e+04   no. steps = 220   stepsize = 2.32e+03
At bottom left:  c1, c2 =    3.554e-08    3.334e+11 
At top right:    c1, c2 =    1.975e-07    4.120e+11 

t = 8.64e+04   no. steps = 223   stepsize = 2.47e+03
At bottom left:  c1, c2 =    7.741e-08    3.352e+11 
At top right:    c1, c2 =   -2.160e-07    4.163e+11 


Final Statistics: 

lenrw   =  4118     leniw   =   297
lenrwls =  2455     leniwls =   126
nst     =   223     nfe     =     0
nfe     =  3259     nfels   =  7612
nni     =  2031     nli     =  7612
nsetups =    78     netf    =    22
npe     =     8     nps     =  9554
ncfn    =     4     ncfl    =   943

In ARKBBDPRE: real/integer local work space sizes = 1300, 192
             no. flocal evals. = 176
